{
  "config": {
    "denylist": [],
    "denylist_source": "assets/knowledge/denylist_ofac_eth.json — run npm run diligence:sync",
    "ofac_oracle": "0x4FD317Ec868fdbd6e95c56f157DDf86d7b97F400"
  },
  "asset": {
    "name": "Manhattan Property Fund",
    "symbol": "MPF",
    "address": "0x975704ca2182b3fc64fd82ad2c01d8ec5be0b5c3",
    "deployed_at": "2026-06-17T06:27:16Z",
    "deploy_tx": "0xd00bcc18e78f85eaa9f62ee907a6adac13c9a45f6f7266699e57487beb61a023",
    "max_holders": 100,
    "max_balance_per_investor": "1000000000000000000000000"
  },
  "diligence": {
    "target": "0xA54A3C2766a80d3AFe7C4Bf00D5bcfF9e1892bc4",
    "target_role": "investor",
    "background": {
      "asset_id": "MPF",
      "jurisdiction": "US",
      "wrapper_type": "permissioned_token"
    },
    "list_snapshots": { "ofac_eth": "2026-06-18" },
    "rating": "GREEN",
    "passed": true,
    "checked_at": "2026-06-17T06:20:00Z",
    "asset_fingerprint": "0xe8d343f2ca60abadc7ac491a9272fa3b4a19eadfe82629924c4d52794e4c65f3",
    "attestation": {
      "registry": "",
      "asset_registry": "",
      "evidence_hash": "0x0a9099ae571a530a124a62f47690b53392c9409a0bad44c8fa8a287452ae18ee",
      "tx": "",
      "at": "",
      "rating_onchain": 2
    },
    "evidence": [
      {
        "check": "denylist",
        "cmd": "compare state.config.denylist[]",
        "result": "miss",
        "infer": "目标不在禁投名单",
        "flag": "ok"
      },
      {
        "check": "is_contract",
        "cmd": "cast code 0xA54A3C2766a80d3AFe7C4Bf00D5bcfF9e1892bc4 --rpc-url $RPC",
        "result": "0x",
        "infer": "EOA",
        "flag": "ok"
      },
      {
        "check": "balance",
        "cmd": "cast balance 0xA54A3C2766a80d3AFe7C4Bf00D5bcfF9e1892bc4 --rpc-url $RPC",
        "result": ">0",
        "infer": "有余额",
        "flag": "ok"
      },
      {
        "check": "tx_count",
        "cmd": "cast nonce 0xA54A3C2766a80d3AFe7C4Bf00D5bcfF9e1892bc4 --rpc-url $RPC",
        "result": "1",
        "infer": "有链上历史",
        "flag": "ok"
      }
    ]
  },
  "whitelist": [
    {
      "addr": "0xA54A3C2766a80d3AFe7C4Bf00D5bcfF9e1892bc4",
      "country": 840,
      "tx": "0x1b212771313c0ad0b382f99c69c027bdd5265e0cc64b619792adbd9038063905",
      "at": "2026-06-17T06:28:00Z"
    }
  ],
  "dividends": [],
  "spawned_skill": {
    "generated": true,
    "path": "skills/MPF-asset",
    "generated_at": "2026-06-17T06:30:00Z"
  },
  "last_action": "spawn_asset_skill",
  "history": [
    {
      "action": "deploy",
      "risk": "high",
      "confirmed_by_human": true,
      "tx": "0xd00bcc18e78f85eaa9f62ee907a6adac13c9a45f6f7266699e57487beb61a023",
      "at": "2026-06-17T06:27:16Z"
    },
    {
      "action": "mint",
      "risk": "high",
      "confirmed_by_human": true,
      "tx": "0x1b212771313c0ad0b382f99c69c027bdd5265e0cc64b619792adbd9038063905",
      "at": "2026-06-17T06:28:00Z"
    },
    {
      "action": "spawn_asset_skill",
      "risk": "low",
      "confirmed_by_human": false,
      "tx": "",
      "at": "2026-06-17T06:30:00Z"
    }
  ]
}
